{
  "$schema": "https://json-schema.org/draft/2020-12/schema",
  "$id": "trial-plan-v1.schema.json",
  "type": "object",
  "additionalProperties": false,
  "required": [
    "schema_version",
    "case_id",
    "kind",
    "argv",
    "cwd",
    "permitted_write_root",
    "inputs",
    "prompt",
    "requirement_ids",
    "dependencies",
    "expected_outputs"
  ],
  "properties": {
    "schema_version": {
      "const": "trial-plan-v1"
    },
    "case_id": {
      "type": "string",
      "pattern": "^[A-Za-z0-9_-]+$"
    },
    "kind": {
      "enum": [
        "native",
        "utility"
      ]
    },
    "argv": {
      "type": "array",
      "minItems": 1,
      "items": {
        "type": "string",
        "minLength": 1
      }
    },
    "cwd": {
      "type": "string"
    },
    "permitted_write_root": {
      "type": "string"
    },
    "inputs": {
      "type": "array",
      "minItems": 1,
      "items": {
        "type": "object",
        "additionalProperties": false,
        "required": [
          "path",
          "sha256"
        ],
        "properties": {
          "path": {
            "type": "string",
            "minLength": 1
          },
          "sha256": {
            "type": "string",
            "pattern": "^[0-9a-f]{64}$"
          }
        }
      }
    },
    "prompt": {
      "anyOf": [
        {
          "type": "object",
          "additionalProperties": false,
          "required": [
            "path",
            "sha256"
          ],
          "properties": {
            "path": {
              "type": "string",
              "minLength": 1
            },
            "sha256": {
              "type": "string",
              "pattern": "^[0-9a-f]{64}$"
            }
          }
        },
        {
          "type": "null"
        }
      ]
    },
    "requirement_ids": {
      "type": "array",
      "minItems": 1,
      "uniqueItems": true,
      "items": {
        "type": "string",
        "minLength": 1
      }
    },
    "dependencies": {
      "type": "array",
      "uniqueItems": true,
      "items": {
        "type": "string",
        "minLength": 1
      }
    },
    "dependency_attempts": {
      "type": "object",
      "additionalProperties": {
        "type": "string"
      }
    },
    "timeout_seconds": {
      "type": "number",
      "exclusiveMinimum": 0
    },
    "expected_outputs": {
      "type": "array",
      "items": {
        "type": "object",
        "additionalProperties": false,
        "required": [
          "path",
          "kind",
          "requirement_id"
        ],
        "properties": {
          "path": {
            "type": "string",
            "minLength": 1
          },
          "kind": {
            "enum": [
              "exists",
              "text",
              "json",
              "manual"
            ]
          },
          "requirement_id": {
            "type": "string"
          },
          "value": {}
        }
      }
    }
  },
  "description": "Runtime additionally validates absolute disjoint roots, hashes, dependency receipts, finite positive limits, output containment and assertion value types."
}
