{
  "schema_version": "trial-plan-v1",
  "case_id": "dependent",
  "kind": "native",
  "argv": [
    "C:\\Program Files\\Python310\\python.exe",
    "-B",
    "C:\\Projects\\DevForgeAI\\docs\\plan\\skill-validator-postmvp-maintenance\\20260914T230521566382Z\\independent\\retest-001\\dependent\\command.py"
  ],
  "cwd": "C:\\Projects\\DevForgeAI\\docs\\plan\\skill-validator-postmvp-maintenance\\20260914T230521566382Z\\independent\\retest-001\\dependent\\project",
  "permitted_write_root": "C:\\Projects\\DevForgeAI\\docs\\plan\\skill-validator-postmvp-maintenance\\20260914T230521566382Z\\independent\\retest-001\\dependent\\project",
  "inputs": [
    {
      "path": "C:\\Projects\\DevForgeAI\\docs\\plan\\skill-validator-postmvp-maintenance\\20260914T230521566382Z\\independent\\retest-001\\dependent\\command.py",
      "sha256": "1732be73c11ee681c6158a603dae3f13df3ec9d0796da987a85d5af9480dbc1a"
    }
  ],
  "prompt": null,
  "requirement_ids": [
    "outcome"
  ],
  "dependencies": [
    "correct-output"
  ],
  "expected_outputs": [
    {
      "path": "report.json",
      "kind": "json",
      "requirement_id": "outcome",
      "value": {}
    }
  ],
  "timeout_seconds": 5,
  "dependency_attempts": {
    "correct-output": "C:\\Projects\\DevForgeAI\\docs\\plan\\skill-validator-postmvp-maintenance\\20260914T230521566382Z\\independent\\retest-001\\correct-output\\attempt"
  }
}